<?xml version="1.0" encoding="UTF-8"?>
<almacen xmlns:xsi="http://www.w3.org/2001/XMLSchema-instance" xsi:noNamespaceSchemaLocation="almacen1.xsd">
	<articulo cod="23">
		<descripcion>ali-kates</descripcion>
		<proveedor>
			<codigo-proveedor>PR-342</codigo-proveedor>
			<nombre-proveedor>Alfonso</nombre-proveedor>
		</proveedor>
		<stock fecha="2012-12-21">345</stock>
	</articulo>
	<articulo cod="47">
		<descripcion>martillo pilon</descripcion>
		<proveedor>
			<codigo-proveedor>PR-999</codigo-proveedor>
			<nombre-proveedor>Mauricio</nombre-proveedor>
		</proveedor>
		<stock fecha="2012-12-11">12</stock>
	</articulo>
</almacen>
